{
  "result_version": "pdf-parser-result-v1",
  "observed_format": "PDF",
  "parser": {
    "name": "knowvault-pdf-observer",
    "version": "2.0.0",
    "artifact_hash": "sha256:0000000000000000000000000000000000000000000000000000000000000000",
    "observation_profile_revision": "pdf-obs-v1"
  },
  "text_units": [],
  "warnings": [
    { "code": "SCANNED_OR_MIXED_PDF" }
  ]
}
